{
  "$schema": "http://json-schema.org/draft-07/schema#",
  "$id": "https://github.com/Ksarelto/dev-cusor-plugins/schemas/marketplace.json",
  "title": "Plugin Marketplace",
  "description": "Schema for .claude-plugin/marketplace.json — defines a Claude Code / Cursor plugin marketplace.",
  "type": "object",
  "required": ["name", "plugins"],
  "additionalProperties": false,
  "properties": {
    "name": {
      "type": "string",
      "minLength": 1,
      "description": "Unique identifier for the marketplace (kebab-case)."
    },
    "owner": {
      "$ref": "#/$defs/owner",
      "description": "The marketplace owner or organisation."
    },
    "description": {
      "type": "string",
      "description": "Short description of the marketplace."
    },
    "version": {
      "type": "string",
      "description": "Marketplace version."
    },
    "metadata": {
      "type": "object",
      "additionalProperties": true,
      "properties": {
        "pluginRoot": {
          "type": "string",
          "description": "Base directory prepended to relative source paths."
        }
      },
      "description": "Arbitrary metadata about the marketplace."
    },
    "plugins": {
      "type": "array",
      "items": { "$ref": "#/$defs/pluginEntry" },
      "description": "List of plugins available in the marketplace."
    }
  },
  "$defs": {
    "owner": {
      "type": "object",
      "required": ["name"],
      "additionalProperties": false,
      "properties": {
        "name": {
          "type": "string",
          "minLength": 1,
          "description": "Owner or organisation name."
        },
        "email": {
          "type": "string",
          "format": "email",
          "description": "Contact email address."
        }
      }
    },
    "pluginEntry": {
      "type": "object",
      "required": ["name", "source"],
      "additionalProperties": false,
      "properties": {
        "name": {
          "type": "string",
          "minLength": 1,
          "pattern": "^[a-z0-9]([a-z0-9.-]*[a-z0-9])?$",
          "description": "Plugin identifier matching the plugin's name in its plugin.json."
        },
        "source": {
          "type": "string",
          "minLength": 1,
          "description": "Path to the plugin directory (relative to the marketplace root) or a remote URL."
        },
        "description": {
          "type": "string",
          "description": "Short description of the plugin."
        },
        "category": {
          "type": "string",
          "description": "Plugin category for marketplace classification."
        },
        "tags": {
          "type": "array",
          "items": { "type": "string" },
          "description": "Tags for filtering and discovery."
        },
        "version": {
          "type": "string",
          "description": "Plugin version override."
        },
        "author": {
          "type": "object",
          "properties": {
            "name": { "type": "string" }
          }
        },
        "strict": {
          "type": "boolean",
          "description": "If true, only this marketplace can provide this plugin name."
        }
      }
    }
  }
}
