{
  "name": "dev-AI-plugins",
  "owner": {
    "name": "Artsiom Murashko"
  },
  "description": "Reusable skills, rules and agents for Claude Code and Cursor.",
  "version": "0.1.0",
  "metadata": {
    "pluginRoot": "."
  },
  "plugins": [
    {
      "name": "base-dev-kit",
      "source": "./base-dev-kit",
      "description": "Honesty and security rules always applied, plus on-demand skills for clean code, git workflow, and testing principles — applicable to any language or stack.",
      "category": "productivity",
      "tags": ["clean-code", "security", "git", "testing", "honesty", "universal"]
    },
    {
      "name": "frontend-dev-kit",
      "source": "./frontend-dev-kit",
      "description": "Rules, skills, and MCP servers for React + TypeScript + shadcn/ui + Tailwind CSS + react-query.",
      "category": "productivity",
      "tags": ["react", "typescript", "shadcn", "tailwind", "react-query", "mcp"]
    },
    {
      "name": "pptx-dev-kit",
      "source": "./pptx-dev-kit",
      "description": "Create a 16:9 PowerPoint from a brief via a checked-in layout engine, or edit an existing .pptx in place via OOXML.",
      "category": "productivity",
      "tags": ["pptx", "powerpoint", "presentation", "slides", "python-pptx", "design-system", "orchestration"]
    },
    {
      "name": "agent-dev-kit",
      "source": "./app-dev-kit/agent-dev-kit",
      "description": "TypeScript/Node AI agents and RAG: OpenAI SDK via OpenRouter, @openai/agents or LangGraph.js, hybrid retrieval, Vitest eval.",
      "category": "productivity",
      "tags": ["ai-agents", "typescript", "nodejs", "openrouter", "openai-sdk", "langgraph-js", "rag", "qdrant"]
    },
    {
      "name": "backend-dev-kit",
      "source": "./app-dev-kit/backend-dev-kit",
      "description": "Rules, skills, and agents for Node.js backends with Express 5, TypeScript, Drizzle ORM, Zod, and Vitest.",
      "category": "productivity",
      "tags": ["nodejs", "typescript", "express", "drizzle", "zod", "vitest", "rest-api", "mcp", "auth", "observability"]
    },
    {
      "name": "spec-dev-kit",
      "source": "./app-dev-kit/spec-dev-kit",
      "description": "Multi-agent pipeline that turns raw requirements in .spec/context/ into a validated, human-approved hybrid YAML+Markdown spec for html-generator-kit, feature-dev-kit, backend-dev-kit, and agent-dev-kit.",
      "category": "productivity",
      "tags": ["spec", "requirements", "yaml", "orchestration", "app-dev-kit"]
    },
    {
      "name": "html-generator-kit",
      "source": "./app-dev-kit/html-generator-kit",
      "description": "Turns a validated spec-dev-kit spec into a clickable Alpine.js multi-page HTML prototype (CDN-free for styling). A provided theme, brand, mockup, or layout is binding; ui-ux-pro-max supplies the design only when none is provided. Headless-browser verified before the skill-owned review gate.",
      "category": "productivity",
      "tags": ["prototype", "html", "alpinejs", "design-system", "ui-ux", "app-dev-kit"]
    },
    {
      "name": "feature-dev-kit",
      "source": "./app-dev-kit/feature-dev-kit",
      "description": "Hub-and-spoke factory that builds one React FSD feature per run (nested screen-tasks share the branch and commit) from a spec-dev-kit spec (and optional html prototype), with architecture-audit, quality gates, and a skill-owned human review. Never opens a PR.",
      "category": "productivity",
      "tags": ["react", "fsd", "feature-sliced-design", "orchestration", "shadcn", "mcp", "app-dev-kit"]
    },
    {
      "name": "frontend-orchestrator-kit",
      "source": "./app-dev-kit/frontend-orchestrator-kit",
      "description": "Frontend-only sequencer: spec-dev-kit to author a spec, html-generator-kit to prototype it, then feature-dev-kit once per feature (nested screen-tasks share that call) against a persisted checklist. Use /orchestrate-app for the full-stack dispatcher.",
      "category": "productivity",
      "tags": ["orchestration", "pipeline", "spec", "prototype", "feature-dev", "checklist", "frontend", "app-dev-kit"]
    },
    {
      "name": "app-orchestrator-kit",
      "source": "./app-dev-kit/app-orchestrator-kit",
      "description": "Full-stack app dispatcher: analyzes an approved spec and optional HTML prototype, then runs backend-dev-kit, agent-dev-kit, and frontend-orchestrator-kit only when needed, against a persisted work-plan.",
      "category": "productivity",
      "tags": ["orchestration", "pipeline", "spec", "prototype", "backend", "agent", "frontend", "work-plan", "app-dev-kit"]
    }
  ]
}
